{
  "task_id": "TASK-101",
  "title": "Implement capt_solo/workspace.py + `capt workspace` CLI group",
  "subsystem": "Workspace",
  "phase": "S1",
  "priority": 1,
  "status": "complete",
  "dependencies": [
    "TASK-100"
  ],
  "invariants": [
    "I-10",
    "I-11"
  ],
  "required_evidence": [
    "capt_solo/workspace.py",
    "capt_cli.py workspace group"
  ],
  "required_tests": [
    "tests/test_workspace.py"
  ],
  "owner_gate": "none",
  "assigned_agent": null,
  "source": "Prompt #1 \u00a78",
  "created_at": "2026-07-26T00:00:00Z",
  "updated_at": "2026-07-29T00:00:00Z",
  "completion_commit": "3b065da",
  "required_capabilities": [
    "filesystem_read",
    "filesystem_write",
    "shell_execution",
    "git_read",
    "test_execution",
    "structured_output"
  ]
}
