{
  "task_id": "TASK-206",
  "title": "Add harness adapter pointers (.codex/.claude/.github/.hermes)",
  "subsystem": "Workspace",
  "phase": "S1",
  "priority": 3,
  "status": "ready",
  "dependencies": [
    "TASK-100"
  ],
  "invariants": [
    "I-10"
  ],
  "required_evidence": [
    ".codex/README.md",
    ".claude/CLAUDE.md",
    ".github/copilot-instructions.md",
    ".hermes/README.md"
  ],
  "required_tests": [
    "tests/test_workspace.py"
  ],
  "owner_gate": "none",
  "assigned_agent": null,
  "source": "Prompt #1 \u00a79",
  "created_at": "2026-07-26T00:00:00Z",
  "updated_at": "2026-07-26T00:00:00Z",
  "completion_commit": null,
  "required_capabilities": [
    "filesystem_read",
    "filesystem_write",
    "git_read",
    "structured_output"
  ]
}