{
  "task_id": "TASK-202",
  "title": "Refresh stale release docs (355/45 -> 463/46) + add workspace evidence doc",
  "subsystem": "Release",
  "phase": "S1",
  "priority": 2,
  "status": "ready",
  "dependencies": [
    "TASK-100"
  ],
  "invariants": [
    "I-15"
  ],
  "required_evidence": [
    "docs/RELEASE_AUDIT_v0.4.md",
    "docs/RELEASE_CANDIDATE_v0.4.0.md",
    "docs/evidence/UNIVERSAL_WORKSPACE_IMPLEMENTATION.md"
  ],
  "required_tests": [
    "tests/test_workspace.py"
  ],
  "owner_gate": "none",
  "assigned_agent": null,
  "source": "Prompt #2 Objective 1",
  "created_at": "2026-07-26T00:00:00Z",
  "updated_at": "2026-07-26T00:00:00Z",
  "completion_commit": null,
  "required_capabilities": [
    "filesystem_read",
    "filesystem_write",
    "git_read",
    "structured_output"
  ]
}